96702,Elena Oana Antonescu,Romania,EPP,Democratic Liberal Party,European parliament,MEP,Patron for Fair Trials,NGO,NGO,no,1,https://www.fairtrials.org/about-us/our-people/patrons/,,Yes,,,,,,,Raphael,,,,,,
96881,Elie Hoarau,France,GUE/NGL,Communist Party of Réunion,European parliament,MEP,Retired,Other,Retired / Deceased,no,1,,,No,,,PCR,,,,TI-FR,,,,,,
4271,Elisabeth Jeggle,Germany,EPP,Christian Democratic Union,European parliament,MEP,Municipal councillor for Biberach ,Public Sector,Elected office,no,1,https://biberach-riss.de/media/custom/1516_1951_1.Democratic PartyF?1450355323,,No,,,,,,,TI-DE,,,,,,
1933,Elisabeth Schroedter,Germany,Greens/EFA,Alliance '90/The Greens,European parliament,MEP,Retired,Other,Retired / Deceased,no,1,,,No,,,,,,,TI-DE,,,,,,
4541,Elizabeth Lynne,United Kingdom,ALDE,Liberal Democrats,European parliament,MEP,No information available,Unknown,Unknown,Unknown,1,,,No,,,LibDems,Confirm,,,Raphael,,,,,,
112071,Emer Costello,Ireland,S&D,Labour Party,European parliament,MEP,EU and Public policy advisor at Intelligence in Science (ISC),Private Sector,Consultancy,yes ,1,https://goo.gl/d0nntN,,Yes,,,,,,,Raphael,,,,,,
96863,Emil Stoyanov,Bulgaria,EPP,Citizens for European Development of Bulgaria,European parliament,MEP,Owner and Chairman of TV Europa,Private Sector,Media,no,1,http://www.tvevropa.com/bg/about_us/management,,No,,,GERB,,,,TI-BG,,,,,,
96703,Emilie Turunen,Denmark,Greens/EFA,Socialist People's Party,European parliament,MEP,Head of public affairs at Nykredit,Private Sector,Company and Group,yes ,1,https://corporateeurope.org/revolvingdoorwatch/cases/emilie-turunen,,No,,,,,,,Raphael ,,,,,,
4348,Emilio Menéndez Del Valle,Spain,S&D,Socialist Workers' Party,European parliament,MEP,No information available,Unknown,Unknown,Unknown,1,,,No,,,PSOE,Confirmed,,,Raphael,,,,,,
28171,Emine Bozkurt,Netherlands,S&D,Labour Party,European parliament,MEP,Member of board of advisers of Institute for Democracy and Electoral Assistance,Public Sector,Elected office,no,1,https://www.linkedin.com/in/eminebozkurt,,No,,,,IDEA is an intergovernmental organisation. ,,,Raphael,,,,,,
96830,Eniko Gyori,Hungary,EPP,Fidesz–Hungarian Civic Union,European parliament,MEP,Ambassador to Spain,Public Sector,Public Sector,no,1,http://www.mfa.gov.hu/kulkepviselet/ES/es/es_munkatarsak/,,No,,,,,,,TI-HU,,,,,,
113883,Erik Bánki,Hungary,EPP,Fidesz-MPP,European parliament,MEP,Member of the Hungarian parliament,Public Sector,Elected office,no,1,,,No,,,,,,,TI-HU,,,,,,
96817,Erminia Mazzoni,Italy,EPP,New Centre Right ,European parliament,MEP,Deputy mayor of Benevento; Lawyer,Public Sector,Elected office,no,2,https://it.wikipedia.org/wiki/Erminia_Mazzoni,,No,,,,,,,Raphael,,,,,,
96766,Ernst Strasser,Austria,EPP,Austrian People's Party,European parliament,MEP,"Founder of CCE- Consulting, Coaching and Education",Private Sector,Consultancy,no,1,https://lobbypedia.de/wiki/Ernst_Strasser,,No,,,OVP,Got recently released from his electronic tag after having been involved in the cash for amendmends scandal ,,,TI-AT,,,,,,
96953,Estelle Grelier,France,S&D,Socialist Party,European parliament,MEP,Secretary of State for local authorities ,Public Sector,Elected office,no,1,http://www.gouvernement.fr/ministre/estelle-grelier,,No,,,PS,,,,TI-FR,,,,,,
28253,Eva Lichtenberger,Austria,Greens/EFA,The Greens–The Green Alternative,European parliament,MEP,No information available,Unknown,Unknown,Unknown,1,https://www.linkedin.com/in/lichtenberger-eva-ba9443a0,,No,,,,Currently discovering new horizons according to her linked profile. ,,,TI-AT,,,,,,
111019,Eva Ortiz Vilella,Spain,EPP,People's Party,European parliament,MEP,Coordinator at the Partido Popular,Public Sector,Political party,no,1,http://www.elmundo.es/comunidad-valenciana/2015/07/31/55bb5ecf268e3e90798b4585.html,,No,,,,,,,Raphael,,,,,,
28134,Eva-Britt Svensson,Sweden,GUE/NGL,Left Party,European parliament,MEP,Chairman of PRO in the city of Vaxjo,Public Sector,Public Sector,no,1,http://www.pro.se/Distrikt/Kronoberg/Samorganisationer/Vaxjo-Samorganisation/Foreningar/PRO-Vaxjo/Har-hittar-du-oss/Styrelsen4/,,No,,,,,,,Raphael,,,,,,
34231,Evgeni Kirilov,Bulgaria,S&D,Coalition for Bulgaria (Socialist Party),European parliament,MEP,No information available,Unknown,Unknown,Unknown,1,,,No,,,,,,,TI-BG,,,,,,
111026,Ewald Stadler,Austria,NI,Alliance for the Future,European parliament,MEP,Lawyer; National party leader of REKOS,Private Sector,Law firm,no,2,https://en.wikipedia.org/wiki/Ewald_Stadler,,No,,,,,,,TI-AT,,,,,,
118709,Fabrizio Bertot,Italy,EPP,Forza Italia,European parliament,MEP,"Founder and managing director of ""Kian for development and culture"" (Consulting services on EU funding)",Private Sector,Consultancy,yes ,1,http://canavesenews.it/news/rivarolo-canavese-fabrizio-bertot-dalla-politica-canavesana-alla-geopolitica-internazionale/,,No,,,,"As seen in the picture, Mr. Bertot is President of this foundation. A news article state's he is the founder.",,,Raphael,,,,,,
28280,Filip Kaczmarek,Poland,EPP,Civic Platform,European parliament,MEP,No information available,Unknown,Unknown,Unknown,1,,,No,,,PO,Confirm,,,Raphael,,,,,,
28477,Fiona Hall,United Kingdom,ALDE,Liberal Democrats,European parliament,MEP,Senior policy advisor at Rockwool International A/S,Private Sector,Consultancy,yes ,1,https://corporateeurope.org/revolvingdoorwatch/cases/fiona-hall,,Yes,,,LibDem,,,,Raphael,,,,,,
96994,Fiorello Provera,Italy,EFDD,Northern League,European parliament,MEP,No information available,Unknown,Unknown,Unknown,1,,,No,,,,,,,Raphael,,,,,,
96979,Francesca Balzani,Italy,S&D,Democratic Party,European parliament,MEP,councillor at the Municipality of Milan; Deputy Mayor of Milan,Public Sector,Elected office,no,2,http://www.ilgiorno.it/milano/politica/francesca-balzani-1.1631064,,No,,,PD,,,,Raphael,,,,,,
116823,Francesca Barracciu,Italy,S&D,Democratic Party,European parliament,MEP,No information available; Prosecuted for misuse of public funds and resigned as Undersecretary for Cultural Heritage,Unknown,Unknown,Unknown,1,https://it.wikipedia.org/wiki/Francesca_Barracciu,,No,,,,Could not find proof of imrpisonment ,,,Raphael,,,,,,
96887,Francesco De Angelis,Italy,S&D,Democratic Party,European parliament,MEP,President of a public economic industrial development consortium in Frisonone ,Public Sector,Public Sector,no,1,http://www.asifrosinone.com/amministrazione-trasparente/francesco-de-angelis-presidente,,No,,,PD,,,,Raphael,,,,,,
997,Francesco Enrico Speroni,Italy,EFDD,Northern League,European parliament,MEP,No information available,Unknown,Unknown,Unknown,1,https://it.wikipedia.org/wiki/Francesco_Speroni,,No,,,,No longer a MP,,,Raphael,,,,,,
118710,Franco Bonanini,Italy,NI,Democratic Party,European parliament,MEP,Sentenced to 10 years of prison for the mismanagement of public funds in the cinque terra project,Other,Prison,no,1,http://www.cittadellaspezia.com/La-Spezia/Politica/Il-day-after-una-citta-col-fiato-220425.aspx,,No,,,,Appears to have been arrested on the 3rd of November.,,,Raphael,,,,,,
118999,Franco Frigo,Italy,S&D,Democratic Party,European parliament,MEP,Owner of Studio Frigo  ,Private Sector,Self-employed,Unknown,1,https://it.wikipedia.org/wiki/Franco_Frigo,,No,,,,,,,Raphael,,,,,,
96750,François Alfonsi,France,Greens/EFA,Party of the Corsican Nation,European parliament,MEP,President of the European Free Alliance,Public Sector,Political party,no,1,http://www.e-f-a.org/whos-who/president/,,No,,,,,,,Raphael ,,,,,,
28148,Françoise Castex,France,S&D,Socialist Party,European parliament,MEP,No information available,Unknown,Unknown,Unknown,1,,,No,,,,No info available ,,,Raphael ,,,,,,
1956,Frank Vanhecke,Belgium,NI,Flemish Interest ,European parliament,MEP,No information available,Unknown,Unknown,Unknown,1,,,No,,,,,,,Raphael,,,,,,
96662,Franziska Katharina Brantner,Germany,Greens/EFA,Alliance '90/The Greens,European parliament,MEP,Member of the German parliament,Public Sector,Elected office,no,1,http://www.bundestag.de/abgeordnete18/biografien/B/brantner_franziska/259392,,No,,,,,,,Raphael,,,,,,
97125,Frédéric Daerden,Belgium,S&D,Socialist Party,European parliament,MEP,MP of the Belgian federal parliament; Mayor of the ciy of Herstal,Public Sector,Elected office,no,2,https://goo.gl/hPlJ41,,No,,,,,,,Raphael,,,,,,
28463,Frieda Brepoels,Belgium,Greens/EFA,New Flemish Alliance,European parliament,MEP,Mayor of Bilzen ,Public Sector,Elected office,no,1,http://www.bilzen.be/burgemeester,,No,,,,,,,Raphael,,,,,,
28367,Gabriele Albertini,Italy,EPP,Civic Choice,European parliament,MEP,Senator,Public Sector,Elected office,no,1,https://en.wikipedia.org/wiki/Gabriele_Albertini,,No,,,,,,,Raphael,,,,,,
4293,Gabriele Stauner,Germany,EPP,Christian Social Union,European parliament,MEP,Lecturer at the Munich College of politics; Member of the Board of Trustees of the University of Budapest,Academia,University,no,2,http://www.csu-europagruppe.de/seiten/stauner.htm,,No,,,CSU,,,,Raphael,,,,,,
96908,Gaston Franco,France,EPP,Union for a Popular Movement,European parliament,MEP,No information available,Unknown,Unknown,Unknown,1,,,No,,,UMP,,,,Raphael,,,,,,
28112,Gay Mitchell,Ireland,EPP,Fine Gael,European parliament,MEP,Member of the Epilepsy Europe Alliance Task force,NGO,NGO,yes ,1,https://www.epilepsyallianceeurope.org/epilepsy-alliance-europe-task-force/,,Yes,,,,NGO but clearly their concerns lobbying EU institutions ,,,Raphael,,,,,,
96846,George Becali,Romania,NI,Greater Romania Party,European parliament,MEP,President of the council of administration of FC Steaua Bucharest,Private Sector,Company and Group,no,1,https://ro.wikipedia.org/wiki/George_Becali,,No,,,PRM,Is emrboiled in many controversies but does not appear to be engaged in lobbying activities,,,Raphael,,,,,,
96959,George Lyon,United Kingdom,ALDE,Liberal Democrats,European parliament,MEP,sSenior consultant at Hume Brophy ,Private Sector,Business association,yes ,1,https://corporateeurope.org/revolvingdoorwatch/cases/george-lyon,,Yes,,,LibDem,,,,Raphael,,,,,,
96856,George Sabin Cutas,Romania,S&D,Conservative Party,European parliament,MEP,No information available,Unknown,Unknown,Unknown,1,,,No,,,,Confirm,,,Raphael,,,,,,
124646,Georgios Gkikopoulos,Greece,GUE/NGL,Communist Party,European parliament,MEP,No information available,Unknown,Unknown,Unknown,1,,,No,,,KKE,No info ,,,Raphael ,,,,,,
97011,Georgios Koumoutsakos,Greece,EPP,New Democracy ,European parliament,MEP,Spokesman of the Greek parliament; Member of Greek parliament,Public Sector,Elected office,no,1,https://www.linkedin.com/in/georgios-koumoutsakos-40689167,,No,,,ND,,,,Raphael,,,,,,
96900,Georgios Papanikolaou,Greece,EPP,New Democracy,European parliament,MEP,Mayor of Glyfada (suburb of Athens) ,Public Sector,Elected office,no,1,https://goo.gl/UDlSED,,No,,,ND,,,,Raphael,,,,,,
28572,Georgios Papastamkos,Greece,EPP,New Democracy,European parliament,MEP,Retired,Other,Retired / Deceased,no,1,https://goo.gl/46Majm,,No,,,ND,,,,Raphael,,,,,,
97008,Georgios Stavrakakis,Greece,S&D,Socialist Movement,European parliament,MEP,Deceased in February 2015,Other,Retired / Deceased,no,1,https://goo.gl/ffrKRM,,No,,,,,,,Raphael,,,,,,
28584,Georgios Toussas,Greece,GUE/NGL,Communist Party,European parliament,MEP,No information available,Unknown,Unknown,Unknown,1,https://fr.wikipedia.org/wiki/Patrice_Tirolien,,No,,,,No longer a mayor of his home time ,,,TI-FR,,,,,,
96758,Gerald Häfner,Germany,Greens/EFA,Alliance '90/The Greens,European parliament,MEP,Dean of the social sciences section of the Goetheanum library,Academia,University,no,1,http://sozial.goetheanum.org/about-us/structure/,,No,,,,,,,Raphael,,,,,,
96996,Giancarlo Scottà,Italy,EFDD,Lega Nord,European parliament,MEP,High school teacher ,Academia,University,no,1,https://www.linkedin.com/in/giancarlo-scotta-17350088,,No,,,,No longer mayor of Veneto,,,Raphael,,,,,,
36396,Gianluca Susta,Italy,S&D,Democratic Party,European parliament,MEP,Senator,Public Sector,Elected office,no,1,http://www.senato.it/leg/17/BGT/Schede/Attsen/00029187.htm,,No,,,PD,,,,Raphael,,,,,,
4398,Gianni Vattimo,Italy,ALDE,Italy of Values,European parliament,MEP,Philosopher professor at University,Academia,University,no,1,https://en.wikipedia.org/wiki/Gianni_Vattimo,,No,,,,,,,Raphael,,,,,,
2097,Giles Chichester,United Kingdom,ECR,Conservative Party,European parliament,MEP,Retired,Other,Retired / Deceased,no,1,https://en.wikipedia.org/wiki/Giles_Chichester,,No,,,,History: http://www.telegRaphael.co.uk/news/2080844/Giles-Chichester-resigns-as-Tory-leader-in-European-parliament-over-expenses-scandal.html,,,Raphael ,,,,,,
110987,Gino Trematerra,Italy,EPP,Union of Christian and Centre Democrats,European parliament,MEP,No information available,Unknown,Unknown,Unknown,1,,,No,,,UDC,,,,Raphael,,,,,,
97131,Giommaria Uggias,Italy,ALDE,Italy of Values,European parliament,MEP,Lawyer,Private Sector,Law firm,no,1,https://www.facebook.com/giommaria.uggias.1/about,,No,,,,,,,Raphael ,,,,,,
97006,Giorgos Papakonstantinou,Greece,S&D,Socialist Movement,European parliament,MEP,Owner and Chairman of GSP-Advisory,Private Sector,Consultancy,no,1,https://www.linkedin.com/in/george-papaconstantinou-52039b72,,No,,,,For whom?,,"Assisting private firms, non-profit organizations and think tanks on political and economic issues. No official websitem, info retrieved from Linkedin. ",Raphael,,,,,,
123792,Giovanni Barbagallo,Italy,S&D,Democratic Party,European parliament,MEP,Regional Councillor for the Liguria region,Public Sector,Elected office,no,1,http://www.regione.liguria.it/regione-liguria/ente/consiglio/consiglieri/item/2002-barbagallo-giovanni.html,,No,,,,No longer a deputy in the Sicilian assembly,,,Raphael,,,,,,
97195,Giovanni Collino,Italy,EPP,The people of freedom,European parliament,MEP,President of Olos srl (consultancy on EU funding),Private Sector,Consultancy,yes ,1,http://www.olosgroup.eu/team-eng/,,No,,,,Helping to get funding is lobbying under the Transparency Register,,,Raphael,,,,,,
4562,Giuseppe Gargani,Italy,EPP,Forza Italia,European parliament,MEP,Lawyer,Private Sector,Law firm,no,3,http://comitatopopolareperilno.it/chi-siamo/,,No,,,,Politically active,,,Raphael,,,,,,
28513,Godfrey Bloom,United Kingdom,NI,United Kingdom Independance Party,European parliament,MEP,Chairman of the parliamentary Mises Book Club (Austrian economics); Independent politician. ,Academia,Think tank,no,2,https://mises.org/profile/godfrey-bloom,,No,,,UKIP,,,,Raphael,,,,,,
4265,Göran Färm,Sweden,S&D,Social Democratic Party,European parliament,MEP,Senior advisor at Diplomat Communications,Private Sector,Consultancy,yes ,1,https://www.linkedin.com/in/g%C3%B6ran-f%C3%A4rm-54a300a2,,No,,,,Diplomat Comms provides EU focussed lobbying through its partner organisation Cabinet DN ,,http://diplomatcom.com/en/what-we-do/public-affairs/,Raphael,,,,,,
97020,Guido Milana,Italy,S&D,Democratic Party,European parliament,MEP,Councillor for the fisheries policy at the Ministry of Agriculture,Public Sector,Public Sector,no,1,https://www.politicheagricole.it/flex/cm/pages/ServeBLOB.php/L/IT/IDPagina/9637,,No,,,PD,,,,Raphael,,,,,,
2295,Hannes Swoboda,Austria,S&D,Social Democratic Party,European parliament,MEP,Political Adviser to European Council on Foreign Afffairs; President of insitute for international peace,Private Sector,Business association,yes ,13,https://www.linkedin.com/in/swoboda-hannes-b76a4a51?trk=pub-pbmap,,Yes,,,,Check this. Need link,,Long list mentionned on Linkedin ,TI-AT,,,,,,
1253,Hans-Gert Pöttering,Germany,EPP,Christian Democratic Union,European parliament,MEP,"Chairman of the Konrad-Adenauer-Stiftung; Member of the Board of directors of the Association for the ""International Charlemagne Prize""; Board Member of ""A sould for Europe""; Honorary MEP; Board Member of the House of European History ",NGO,NGO,no,3,https://de.wikipedia.org/wiki/Hans-Gert_P%C3%B6ttering,,Yes,,,,Also a Member of the A soul for Europe with Doris Pack,,,Check,,,,,,
4238,Hans-Peter Martin,Austria,NI,Hans-Peter Martin's List,European parliament,MEP,Journalist,Private Sector,Media,no,1,,,No,,,,,,,TI-AT,,,,,,
4275,Hans-Peter Mayer,Germany,EPP,Christian Democratic Union,European parliament,MEP,No information available,Unknown,Unknown,Unknown,1,,,No,,,,Not working in conulting,,,TI-DE,,,,,,
4318,Harlem Désir,France,S&D,Socialist Party,European parliament,MEP,Secretary of State for European Affairs ,Public Sector,Elected office,no,1,http://www.diplomatie.gouv.fr/en/the-minister-and-the-ministers-of-state/harlem-desir/,,No,,,,,,,TI-FR,,,,,,
4294,Heide Rühle,Germany,Greens/EFA,Alliance '90/The Greens,European parliament,MEP,No information available,Unknown,Unknown,Unknown,1,,,No,,,,,,,TI-DE,,,,,,
4385,Hélène Flautre,France,Greens/EFA,Europe Ecology,European parliament,MEP,Munipal councillor in the city of Arras; Head of Mission - European Citizenship at the Lille academy ,Public Sector,Elected office,no,1,https://www.arras.fr/fr/elus,,No,,,,,,,Raphael,,,,,,
96879,Hella Ranner,Austria,EPP,Austrian People's Party,European parliament,MEP,Sentenced to 2 years of prison in 2014,Other,Prison,no,1,https://de.wikipedia.org/wiki/Hella_Ranner,,No,,,OVP,Should come out soon though,,,TI-AT,,,,,,
2319,Henri Weber,France,S&D,Socialist Party,European parliament,MEP,Retired,Other,Retired / Deceased,no,1,https://fr.wikipedia.org/wiki/Henri_Weber,,No,,,PS,,,,TI-FR,,,,,,
1059,Hiltrud Breyer,Germany,Greens/EFA,Alliance '90/The Greens,European parliament,MEP,Member of the Scientific Advisory Committe of the Coalition against BAYER dangers (CBG),NGO,NGO,Unknown,1,http://www.cbgnetwork.org/38.html,,No,,,,,,,Raphael,,,,,,
28247,Holger Krahmer,Germany,ALDE,Free Democratic Party,European parliament,MEP,Director European affairs public policy and government relations at Opel Group,Private Sector,Consultancy,yes ,1,https://corporateeurope.org/revolvingdoorwatch/cases/holger-krahmer,,Yes,,,,,,,TI-DE,,,,,,
1930,Horst Schnellhardt,Germany,EPP,Christian Democratic Union,European parliament,MEP,No information available,Unknown,Unknown,Unknown,1,,,No,,,,,,,TI-DE,,,,,,
2307,Hubert Pirker,Austria,EPP,Austrian People's Party,European parliament,MEP,Owner and business consultant of Dr. Hubert Pirker - EUCONET,Private Sector,Consultancy,yes ,1,http://www.euconet.at/dr-hubert-pirker-2/cv/?lang=en,,No,,,OVP,,,,TI-AT,,,,,,
23695,Hynek Fajmon,Czech Republic,ECR,Civic Democratic Party,European parliament,MEP,Consultant,Private Sector,Consultancy,yes ,1,http://www.bpresearch.eu/lide,,No,,,,Brussels based lobbying,,,Raphael,,,,,,
4466,Ilda Figueiredo,Portugal,GUE/NGL,Democratic Unity Coalition (Communist Party),European parliament,MEP,No information available,Unknown,Unknown,Unknown,1,,,No,,,,,,,Raphael,,,,,,
96834,Iliana Ivanova,Bulgaria,EPP,Citizens for European Development of Bulgaria,European parliament,MEP,Member of the European Court of Auditors ,Public Sector,Public Sector,no,1,http://www.eca.europa.eu/en/Pages/OrganizationChartList.aspx,,No,,,GERB,,,,Ti-BG,,,,,,
119875,Iñaki Irazabalbeitia Fernández,Spain,Greens/EFA,Aralar Party,European parliament,MEP,Academic for Euskaltzaindia (Academy of the basque language),Academia,University,no,1,http://www.euskaltzaindia.eus/index.php?option=com_content&view=article&id=4764&Itemid=405&lang=eu,,No,,,,,,,Raphael,,,,,,
1873,Íñigo Méndez De Vigo,Spain,EPP,People's Party,European parliament,MEP,Minister of Education and Culture; Member of the Spanish parliament,Public Sector,Elected office,no,1,http://www.mecd.gob.es/ministerio-mecd/ministro.html,,No,,,PP,,,,Raphael,,,,,,
96859,Ioan Enciu,Romania,S&D,Social Democratic Party,European parliament,MEP,No information available,Unknown,Unknown,Unknown,1,,,No,,,,Confirm,,,Raphael,,,,,,
96898,Ioannis A. Tsoukalas,Greece,EPP,New Democracy,European parliament,MEP,Professor at the Aristotle University of Thessanloniki,Academia,University,no,1,https://goo.gl/wk2XiP,,Yes,,,,,,,Raphael ,,,,,,
28474,Ioannis Kasoulides,Cyprus,EPP,Democratic Rally,European parliament,MEP,Minister of Foreign Affairs,Public Sector,Elected office,no,1,http://www.mfa.gov.cy/mfa/mfa2016.nsf/All/277ED5DD99EFEB25C2257F9C00209CFF?OpenDocument,,No,,,,,,,Raphael,,,,,,
95017,Iosif Matula,Romania,EPP,Democratic Liberal Party,European parliament,MEP,Professor at the Arad High School ,Academia,University,no,1,https://www.facebook.com/pages/Iosif-Matula/144306458917399?fref=ts,,No,,,,,,,Raphael,,,,,,
96639,Isabelle Durant,Belgium,Greens/EFA,Ecolo,European parliament,MEP,Member of the Brussels-Capital regional parliament,Public Sector,Elected office,no,1,https://goo.gl/AR9q3l,,No,,,,,,,Raphael,,,,,,
41007,Iva Zanicchi,Italy,EPP,The people of freedom,European parliament,MEP,Retired,Other,Retired / Deceased,no,1,https://it.wikipedia.org/wiki/Iva_Zanicchi,,No,,,,Retired,,,Raphael,,,,,,
96807,Ivailo Kalfin,Bulgaria,S&D,Coalition for Bulgaria (Socialist Party),European parliament,MEP,Official candidate for the Presidency,Public Sector,Political party,no,1,"http://www.novinite.com/articles/176751/Ivaylo+Kalfin,+the+Seasoned+Politician+Facing+an+Uphill+Battle",,No,,,,,,,Raphael,,,,,,
97025,Ivari Padar,Estonia,S&D,Social Democratic Party,European parliament,MEP,Member of the Estonian parliament ,Public Sector,Elected office,no,1,http://www.riigikogu.ee/en/parliament-of-estonia/composition/members-riigikogu/,,No,,,,,,,Raphael,,,,,,
97004,Ivars Godmanis,Latvia,ALDE,Latvia's First Party/Latvian Way,European parliament,MEP,No information available,Unknown,Unknown,Unknown,1,https://fr.wikipedia.org/wiki/Ivars_Godmanis,,No,,,,No info ,,,Raphael ,,,,,,
28320,Ivo Strejcek,Czech Republic,ECR,Civic Democratic Party,European parliament,MEP,Advisor to former President Vaclav Havel ,Public Sector,Political party,no,1,https://cs.wikipedia.org/wiki/Ivo_Strej%C4%8Dek,,No,,,,,,,Raphael,,,,,,
96795,Jacek Olgierd Kurski,Poland,ECR,Law and Justice,European parliament,MEP,General Director of Polish Television,Private Sector,Media,no,1,https://pl.wikipedia.org/wiki/Jacek_Kurski,,No,,,PiS,Got nominated by the current administration,,,Raphael,,,,,,
23782,Jacek Protasiewicz,Poland,EPP,Civic Platform,European parliament,MEP,Member of the Polish parliament,Public Sector,Elected office,no,1,http://www.sejm.gov.pl/Sejm8.nsf/posel.xsp?id=312,,No,,,,,,,Raphael,,,,,,
96802,Jacek Wlosowicz,Poland,ECR,Law and Justice,European parliament,MEP,Senator,Public Sector,Elected office,no,1,"https://www.senat.gov.pl/sklad/senatorowie/senator,468,9,jacek-wlosowicz.html",,No,,,PiS,,,,Raphael,,,,,,
28215,Jacky Hénin,France,GUE/NGL,Left Front,European parliament,MEP,Municipal Councelor in in the city of Calais; Secretary of the Communist Pary division of la Somme,Public Sector,Elected office,no,1,http://www.calais.fr/fr/Ville-de-Calais/la-mairie/vie-municipale/les-elus/presentation?userprofile=566841111a6c7e89089a8a7f,,No,,,,Unclear if this is a job,,Elected in the city of Calais ,Raphael,,,,,,
28362,Jaime Mayor Oreja,Spain,EPP,People's Party,European parliament,MEP,President of the Valores y Sociedad foundation,NGO,NGO,no,1,,,No,,,PP,,,http://www.valoresysociedad.org/patronato/,Raphael,,,,,,
1419,James Elles,United Kingdom,ECR,Conservative Party,European parliament,MEP,Chairman of the management committee of the transatlantic policy network ,NGO,NGO,yes ,1,http://www.tpnonline.org/organisation/whos-who/,,Yes,,,,Check what James is up to. Internet Foundation is not his job.,,The TPN has been active in lobying in favour of the TTIP,Raphael,,,,,,
28354,Jan Brezina,Czech Republic,EPP,Christian and Democratic Union,European parliament,MEP,Municipal councillor in the city of Unicov,Public Sector,Elected office,no,1,http://www.unicov.cz/ing-jan-brezina/o-1098/p1=13480,,No,,,,No Others info,,,Raphael ,,,,,,
101954,Jan Kozlowski,Poland,EPP,Civic Platform,European parliament,MEP,President of the Polish Rugby Association; Vice-President of the European Federation of Rugby ,NGO,NGO,no,2,https://pl.wikipedia.org/wiki/Jan_Koz%C5%82owski_(samorz%C4%85dowiec),,No,,,PO,,,,Raphael ,,,,,,
1965,Jan Mulder,Netherlands,ALDE,People's Party for Freedom and Democracy,European parliament,MEP,Retired,Other,Retired / Deceased,no,1,http://www.vvd.frl/tag/jan-mulder/,,No,,,VVD,Provides occasional speeches to senior Members of his party,,,Raphael,,,,,,
96659,János Áder,Hungary,EPP,Fidesz–Hungarian Civic Union,European parliament,MEP,President of Hungary,Public Sector,Elected office,no,1,http://www.keh.hu/president_janos_ader/1582-Curriculum_vitae_of_Janos_Ader,,No,,,,,,,TI-CY,,,,,,
96654,Jaroslav Paška,Slovakia,EFDD,National Party,European parliament,MEP,Member of the Slovak parliament,Public Sector,Elected office,no,1,http://www.nrsr.sk/web/Default.aspx?sid=poslanci/poslanec&PoslanecID=103&CisObdobia=7,,No,,,,,,,Raphael,,,,,,
2315,Jean Louis Cottigny,France,S&D,Socialist Party,European parliament,MEP,Vice-Président du departemental council; Board Member of Pas de Calais Habitat,Public Sector,Elected office,no,1,http://www.pasdecalais.fr/L-institution/Vos-elus/(tri)/nom,http://www.pasdecalais-habitat.fr/fr/accueil/pas-de-calais-habitat/decouvrir-pas-de-calais-habitat/le-conseil-dadministration.aspx,No,,,PS,,,,Raphael,,,,,,
111068,Jean Roatta,France,EPP,Socialist Party,European parliament,MEP,Councillor to the Mayor of Marseille; Vice-President of the Commission on Human Rights,Public Sector,Elected office,no,1,http://marseille1-7.fr/la-mairie/le-maire-et-ses-adjoints/,,No,,,PS,,,,Raphael,,,,,,
97021,Jean-Claude Marcourt,Belgium,S&D,Socialist Party,European parliament,MEP,Vice-President of the Wallonian government; Vice-President of the Brussels- Wallonia Federation,Public Sector,Elected office,no,2,https://fr.wikipedia.org/wiki/Jean-Claude_Marcourt,,No,,,PS,,,,Raphael,,,,,,
28176,Jeanine Hennis-Plasschaert,Netherlands,ALDE,People's Party for Freedom and Democracy,European parliament,MEP,Minister of Defence,Public Sector,Elected office,no,1,https://en.wikipedia.org/wiki/Jeanine_Hennis-Plasschaert,,No,,,VVD,,,,Raphael,,,,,,
