ID,Name,Country,Political_group,Party,Institution,Previous_position,New_position,category_new_position,category_bar,brussel_lobbying,total_activities,Link_source,Link_profile,on_JTR,Link_picture,Comments,group2,Description,Paid_unpaid,Answers,Certified,Date of Commission authorisation,Based on advice from Ad hoc Ethical Committee?,Link to authorisation in College of Commissioners' minutes,"Link to Commission authorisation documents, released under freedom of information rules. Click on the links to read the documents",Link Transparency register,Number of activities 
17,Viviane Reding,Luxembourg,EPP,Christian Social People's Party,European Commission,"Commissioner for Justice, Fundamental Rights and Citizenship",MEP; Board Member of Nyrstar,Private Sector,Company and Group,Yes,9,http://ec.europa.eu/transparency/regdoc/rep/10061/2014/EN/10061-2014-2103-EN-F1-1.Pdf,,Yes,https://upload.wikimedia.org/wikipedia/commons/thumb/9/95/Viviane_Reding_%28Martin_Rulsch%29_01.jpg/330px-Viviane_Reding_%28Martin_Rulsch%29_01.jpg,,,"provided that Ms REDING respected Article 339 of the Treaty on the Functioning of the European Union and that, within the 18 months after ceasing to hold office, she abstained from lobbying and defending Nyrstar's interests to the Commission ",,,,29/10/2014,no,http://ec.europa.eu/transparency/regdoc/rep/10061/2014/EN/10061-2014-2103-EN-F1-1.Democratic Partyf,http://www.asktheeu.org/en/request/1549/response/5975/attach/4/annex%20ii.Democratic Partyf + http://www.asktheeu.org/en/request/1549/response/6127/attach/4/annex%20i.Democratic Partyf + http://www.asktheeu.org/en/request/1549/response/6127/attach/6/annex%20iii.Democratic Partyf,http://ec.europa.eu/transparencyregister/public/consultation/displaylobbyist.do?id=202136122160-22,
20,Tonio Borg,Malta,EPP,Nationalist Party,European Commission,Commissioner for Health,Representative of the EP on the management board of the European Medicines Agency,Public Sector,Public Sector,No,2,http://ec.europa.eu/transparency/regdoc/rep/10061/2016/EN/10061-2016-2165-EN-F1-1.PdF,,No,https://upload.wikimedia.org/wikipedia/commons/thumb/b/bc/Tonio_Borg_%28cropped%29.jpg/330px-Tonio_Borg_%28cropped%29.jpg,,,provided  that  Mr BORG  acted  in  all  circumstances  with integrity  and  discretion  in  respect  of  experience  and  knowledge  gained either directly or indirectly during his term of office,?,,,20/4/2016,?,http://ec.europa.eu/transparency/regdoc/rep/10061/2016/EN/10061-2016-2165-EN-F1-1.Democratic PartyF,,,
26,Štefan Füle ,Czech Republic,S&D,Czech Social Democratic Party,European Commission,Commissioner for Enlargement and European Neighbourhood Policy,Special representative of the OSCE ,Public Sector,Public Sector,No,6,http://ec.europa.eu/transparency/regdoc/rep/10061/2016/EN/10061-2016-2152-EN-F1-1.PdF,,Yes,https://upload.wikimedia.org/wikipedia/commons/thumb/f/f8/Stefan_File.jpg/330px-Stefan_File.jpg,,,"reminded Mr FÜLE  of  the  obligations  he  remained  under, concerning  the  protection  of  collective  responsibility  and  confidentiality  of the  matters  dealt  with  by  the  Commission  during  his  term  of  office  in accordance with Articles245(2) and 339 of the TFEU",,,,19/1/2016,no,http://ec.europa.eu/transparency/regdoc/rep/10061/2016/EN/10061-2016-2152-EN-F1-1.Democratic PartyF,,,
29,Siim Kallas,Estonia,ALDE,Estonian Reform Party,European Commission,Commissioner for Transport,Consultant for Nortal ,Private Sector,Company and Group,Yes,5,http://ec.europa.eu/transparency/regdoc/rep/10061/2015/EN/10061-2015-2122-EN-F1-1.PdF,,Yes,https://upload.wikimedia.org/wikipedia/commons/thumb/c/c0/Siim_Kallas%2C_arvamusfestival_2014_%282%29.jpg/330px-Siim_Kallas%2C_arvamusfestival_2014_%282%29.jpg,,,"On the condition that you abide by your obligations stipulated in Articles 245 and 339 of the TFEU and in the Code of Conduct for Commissioners, namely that you behave, in all circumstances, with integrity and discretion, that you protect the collegiality and confidentiality of the matters dealt with by the Commission during your mandates and that you refrain from lobbying the Commission and/or its services, for Nortal, during eighteen months after the end of your mandate ",paid  ,,,22/4/2015,no,http://ec.europa.eu/transparency/regdoc/rep/10061/2015/EN/10061-2015-2122-EN-F1-1.Democratic PartyF,http://www.asktheeu.org/en/request/1947/response/7005/attach/2/annexes.Democratic Partyf,http://ec.europa.eu/transparencyregister/public/consultation/displaylobbyist.do?id=641536622019-91,
33,Olli Rehn,Finland,ALDE,Centre Party,European Commission,Commissioner for Economic and Monetary Affairs and the Euro,Minister for Economic Affairs; MP,Public Sector,Elected office,No,4,,,No,https://upload.wikimedia.org/wikipedia/commons/thumb/a/ad/Olli_Rehn_by_Moritz_Kosinsky_2.jpg/330px-Olli_Rehn_by_Moritz_Kosinsky_2.jpg,,,No authorisation required,paid  ,,,29/5/2015,no,,,,
35,Nelli Feroci,Italy,EPP,???,European Commission,Commissioner for Industry and entrepreneurship,Chair of the Board of Directors of Simest ,Private Sector,Company and Group,No,2,http://ec.europa.eu/transparency/regdoc/rep/10061/2014/EN/10061-2014-2103-EN-F1-1.Pdf,,No,,,,,,,,29/10/2014,yes,http://ec.europa.eu/transparency/regdoc/rep/10061/2014/EN/10061-2014-2103-EN-F1-1.Democratic Partyf,http://www.asktheeu.org/en/request/1549/response/5975/attach/7/annex%20iii.Democratic Partyf + http://www.asktheeu.org/en/request/1549/response/6127/attach/6/annex%20iii.Democratic Partyf + http://www.asktheeu.org/en/request/1549/response/6127/attach/7/annex%20iv.Democratic Partyf,,
39,Neelie Kroes,Netherlands,ALDE,People's Party for Freedom and Democracy,European Commission,Commissioner for Digital agenda,Member advisory Board of Uber,Private Sector,Company and Group,Yes,5,http://www.asktheeu.org/en/request/neelie_kroes_uber#incoming-9774,,Yes,https://upload.wikimedia.org/wikipedia/commons/thumb/4/49/Neelie_Kroes.jpg/375px-Neelie_Kroes.jpg,,,No authorisation required as 18 month authorisation and lobby ban has now ended,paid in shares,,,- ,?,http://www.asktheeu.org/en/request/neelie_kroes_uber#incoming-9774,http://corporateeurope.org/revolvingdoorwatch/cases/neelie-kroes,http://ec.europa.eu/transparencyregister/public/consultation/displaylobbyist.do?id=002278013515-26,
45,Michel Barnier,France ,EPP,Union for a Popular Movement,European Commission,Commissioner for Economic and Monetary Affairs and the Euro,Chief Negotiator for BREXIT,Public Sector,Public Sector,No,4,?,,Yes,https://upload.wikimedia.org/wikipedia/commons/thumb/5/50/Barnier%2C_Michel-9568.jpg/330px-Barnier%2C_Michel-9568.jpg,,,?,,,,?,?,?,? ,,
46,Martine Reicherts,Luxembourg,S&D,Luxemburg Socialist Workers Party,European Commission,"Commissioner for Justice, Fundamental Rights and Citizenship",Director-general of Education and Culture at the European Commission,Public Sector,Public Sector,No,1,,,No,https://upload.wikimedia.org/wikipedia/commons/thumb/9/91/Martine_Reicherts.jpg/399px-Martine_Reicherts.jpg,,,No authorisation required,paid  ,,,1/11/2014,no,,,,
48,Maria Damanaki,Greece,S&D,Panhellenic Socialist Movement,European Commission,Commissioner for Maritime affairs and fisheries,Global Managing Director for Oceans at The Nature Conservancy ,NGO,NGO,Yes,2,http://ec.europa.eu/transparency/regdoc/rep/10061/2015/EN/10061-2015-2111-EN-F1-1.Pdf,,Yes,https://upload.wikimedia.org/wikipedia/commons/8/80/Maria_Damanaki.jpg,,,provided Ms DAMANAKI abstained from lobbying the Commission and its departments on any issues with a potential link to her former portfolio on fisheries and maritime affairs for 18 months after leaving the Commission. ,paid  ,,,13/1/2015,yes,http://ec.europa.eu/transparency/regdoc/rep/10061/2015/EN/10061-2015-2111-EN-F1-1.Democratic Partyf,http://www.asktheeu.org/en/request/1708/response/6322/attach/3/annex.Democratic Partyf + http://www.asktheeu.org/en/request/1708/response/6181/attach/2/annexes.Democratic Partyf,http://ec.europa.eu/transparencyregister/public/consultation/displaylobbyist.do?id=116042012787-45,
49,Máire Geoghegan-Quinn,Ireland,ALDE,Fianna Fáil,European Commission,"Commissioner for Research, Innovation and Science",Board Member of the Biomedical Sciences Institute at Trinity College (TBSI),Academia,University,No,3,http://ec.europa.eu/transparency/regdoc/rep/10061/2015/EN/10061-2015-2138-EN-F1-1.PdF,,No,https://upload.wikimedia.org/wikipedia/commons/thumb/a/a8/M%C3%A1ire_Geoghegan-Quinn_International_Year_of_Chemistry.jpg/330px-M%C3%A1ire_Geoghegan-Quinn_International_Year_of_Chemistry.jpg,,,"Providing Ms GEOGHEGAN-QUINN, for 18 months after leaving the Commission, (i) referred proactively to the internal rules of TBSI in order to refrain from participating in any dossiers concerning relations between TBSI and the European Commission and the programmes of the European Union, (ii) refrained from lobbying the Commission and/or its departments with regard to any financing requests from TBSI to the European Union, and (iii) ensured that none of TBSI's commercial partners, either current or potential, could unduly benefit from the knowledge and experience Ms GEOGHEGAN-QUINN gained during her term of office. ",“the role is non-remunerated but...”,,,16/9/2015,yes,http://ec.europa.eu/transparency/regdoc/rep/10061/2015/EN/10061-2015-2138-EN-F1-1.Democratic PartyF,http://www.asktheeu.org/en/request/2293/response/8158/attach/2/2015%205055.Democratic Partyf,,
53,László Andor,Hungary,S&D,Hungarian Socialist Party,European Commission,"Commissioner for Employment, Social Affairs and Inclusion",Advisory Board of the European Policy Centre ,Academia,Think tank,Yes,8,http://ec.europa.eu/transparency/regdoc/rep/10061/2014/EN/10061-2014-2110-EN-F1-1.Pdf,,Yes,https://upload.wikimedia.org/wikipedia/commons/thumb/7/78/Andor%2C_L%C3%A1szl%C3%B3-9469.jpg/330px-Andor%2C_L%C3%A1szl%C3%B3-9469.jpg,,,"provided that Mr ANDOR abstained from any lobbying of the Commission and its departments, should any of the aforementioned organisations decide to get involved in specific projects relating to his former portfolio and ask for financing from the European Union; ",unpaid,,,16/12/2014,no,http://ec.europa.eu/transparency/regdoc/rep/10061/2014/EN/10061-2014-2110-EN-F1-1.Democratic Partyf,http://www.asktheeu.org/en/request/1693/response/6136/attach/3/documents.Democratic Partyf,http://ec.europa.eu/transparencyregister/public/consultation/displaylobbyist.do?id=89632641000-47,
61,Karel de Gucht,Belgium,ALDE,Open Flemish Liberals and Democrats,European Commission,Commissioner for Trade,Director of ArcelorMittal,Private Sector,Company and Group,Yes,7,http://www.asktheeu.org/en/request/karel_de_gucht_arcelormittal#incoming-9775,,Yes,https://upload.wikimedia.org/wikipedia/commons/thumb/7/7c/Karel-de-gucht.jpg/330px-Karel-de-gucht.jpg,,,No authorisation required as 18 month authorisation and lobby ban has now ended,paid  ,,,-,?,http://www.asktheeu.org/en/request/karel_de_gucht_arcelormittal#incoming-9775,http://corporateeurope.org/revolvingdoorwatch/cases/karel-de-gucht,http://ec.europa.eu/transparencyregister/public/consultation/displaylobbyist.do?id=23527541824-60,
67,José Manuel Barroso,Portugal,EPP,Social Democratic Party,European Commission,President of the European Commission,Non-executive chairman of Goldman Sachs,Private Sector,Company and Group,Yes,23,http://www.goldmansachs.com/media-relations/press-releases/current/jose-manuel-barroso-appointed.html,,Yes,https://upload.wikimedia.org/wikipedia/commons/thumb/4/47/Jose_Manuel_Barroso%2C_EU-kommissionens_ordforande%2C_under_ett_mote_i_Folketinget_2006-05-19_%281%29.jpg/330px-Jose_Manuel_Barroso%2C_EU-kommissionens_ordforande%2C_under_ett_mote_i_Folketinget_2006-05-19_%281%29.jpg,,,No authorisation required as 18 month authorisation and lobby ban has now ended,paid  ,,,8/7/2016,no,http://www.goldmansachs.com/media-relations/press-releases/current/jose-manuel-barroso-appointed.html,,http://ec.europa.eu/transparencyregister/public/consultation/displaylobbyist.do?id=701266814986-18,
90,John Dalli,Malta,EPP,Nationalist Party,European Commission,Commissioner for Health and Consumer Policy,Advisor on hospital reform for the Maltese government ,Private Sector,Consultancy,no,1,http://ec.europa.eu/transparency/regdoc/rep/10061/2013/EN/10061-2013-2061-EN-F1-1.Pdf,,No,https://upload.wikimedia.org/wikipedia/commons/thumb/a/ac/John_Dalli_2011.jpg/330px-John_Dalli_2011.jpg,,,"“the Commission wishes to remind Mr Dalli that, according to point 1.2 of the Code of Conduct for Commissioners, a former Commissioner shall not, during a period of 18 months after ceasing to hold office, lobby or advocate with the Members of the Commission and their staff on matters for which they were responsible within their portfolio and that former Commissioners are required not to disclose information of the kind covered by the obligation of professional secrecy, even after their duties ceased.",unpaid,,,2/10/2013,no,http://ec.europa.eu/transparency/regdoc/rep/10061/2013/EN/10061-2013-2061-EN-F1-1.Democratic Partyf,http://www.asktheeu.org/en/request/2196/response/7841/attach/3/annexes.Democratic Partyf,,
95,Joaquín Almunia,Spain,S&D,Spanish Socialist Workers' Party,European Commission,Commissioner for Competition,Advisory Board Member of the Centre for European Policy Studies,Academia,Think tank,Yes,14,http://ec.europa.eu/transparency/regdoc/rep/10061/2015/EN/10061-2015-2135-EN-F1-1.PdF,,Yes,https://upload.wikimedia.org/wikipedia/commons/thumb/2/2a/Joaquin_Almunia_Mercosul.jpg/330px-Joaquin_Almunia_Mercosul.jpg,,,provided that for eighteen months after leaving his post at the Commission Mr ALMUNIA refrained from any lobbying of the Commission or its departments on behalf of the organisation in question on any matters relating to his previous portfolio ,unpaid,,,15/7/2015,no,http://ec.europa.eu/transparency/regdoc/rep/10061/2015/EN/10061-2015-2135-EN-F1-1.Democratic PartyF,http://www.asktheeu.org/en/request/2172/response/7705/attach/2/Annexes.Democratic Partyf,http://ec.europa.eu/transparencyregister/public/consultation/displaylobbyist.do?id=86853666704-95,
107,Janusz Lewandowski,Poland,EPP,Civic Platform,European Commission,Commissioner for Financial Programming and Budget,MEP,Public Sector,Elected office,no,1,,,No,https://upload.wikimedia.org/wikipedia/commons/thumb/b/b5/Janusz_Lewandowski_Sejm_2016.JPG/330px-Janusz_Lewandowski_Sejm_2016.JPG,,,No authorisation required,paid  ,,,- ,no,,,,
113,Janez Potocnik,Slovenia,ALDE,Liberal Democracy,European Commission,Commissioner for Environment,President of the Forum for the Future of Agriculture ,NGO,NGO,no,7,http://ec.europa.eu/transparency/regdoc/rep/10061/2014/EN/10061-2014-2109-EN-F1-1.Pdf,,Yes,https://upload.wikimedia.org/wikipedia/commons/thumb/9/95/Janez_Poto%C4%8Dnik%2C_Strasbourg_-_Diliff.jpg/330px-Janez_Poto%C4%8Dnik%2C_Strasbourg_-_Diliff.jpg,,,"providing his activities relating to organising the programme for the Forum's annual conference, the list of participants and chairing the annual conference did not include anything connected to the commercial interests of Syngenta; ",,,,10/12/2014,yes,http://ec.europa.eu/transparency/regdoc/rep/10061/2014/EN/10061-2014-2109-EN-F1-1.Democratic Partyf,http://www.asktheeu.org/en/request/1549/response/5975/attach/6/annex%20vi.Democratic Partyf + http://www.asktheeu.org/en/request/1549/response/6127/attach/6/annex%20iii.Democratic Partyf + http://www.asktheeu.org/en/request/1549/response/6127/attach/7/annex%20iv.Democratic Partyf,,
115,Jacek Dominik ,Poland,EPP,Civic Platform,European Commission,Commissioner for Budget,Member of the audit committe of the EIB ,Public Sector,Public Sector,no,2,http://www.eib.org/about/governance-and-structure/statutory-bodies/audit_committee/,,No,,,,,,,,,,,,,
118,Dacian Ciolos,Romania,NI ,Independent,European Commission,Commissioner for Agriculture,Prime minister of Romania,Public Sector,Elected office,no,4,http://www.politico.eu/article/former-commissioner-to-be-romanian-prime-minister/,,Yes,https://upload.wikimedia.org/wikipedia/commons/thumb/4/4c/EPP_Congress_2187_%288096672652%29_%28cropped%29.jpg/330px-EPP_Congress_2187_%288096672652%29_%28cropped%29.jpg,,,No authorisation required,,,,11/11/2015,no,http://www.politico.eu/article/former-commissioner-to-be-romanian-prime-minister/,,,
124,Connie Hedegaard,Denmark,EPP,Conservative People's Party,European Commission,Commissioner for Climate action,Member of the sustainability council at Volkswagen AG,Private Sector ,Company and Group,Yes,7,Withdrawn before COM decision made,,Yes,https://upload.wikimedia.org/wikipedia/commons/thumb/9/9b/Connie_Hedegaard%2C_Danmarks_miljominister_och_nordisk_samarbetsminister.jpg/330px-Connie_Hedegaard%2C_Danmarks_miljominister_och_nordisk_samarbetsminister.jpg,,,"CH emailed COM for authorisation for this activity on 11/11/14. The ad hoc ethical committee provided its opinion on 5/12/14. CH provided further information on 22/2/15. Ad hoc ethical committee provided a further opinion on 26/2/15. Following an email from Catherine Day, on 5/3/15, CH withdraws request.",,,,- ,yes,http://www.volkswagenag.com/en/sustainability/sustainability-council.html,http://www.asktheeu.org/en/request/1691/response/6133/attach/3/RE%20Cann.Democratic Partyf + http://www.asktheeu.org/en/request/2133/response/7677/attach/3/annexes.Democratic Partyf,http://ec.europa.eu/transparencyregister/public/consultation/displaylobbyist.do?id=6504541970-40,
134,Catherine Ashton,UK,S&D,Labour Party,European Commission,High Representative of the Union for Foreign Affairs and Security Policy,Member of the House of Lords,Public Sector,Elected office,no,6,http://ec.europa.eu/transparency/regdoc/rep/10061/2015/EN/10061-2015-2122-EN-F1-1.PdF,,No,https://upload.wikimedia.org/wikipedia/commons/thumb/8/8b/Catherine_Ashton%2C_Head_of_the_European_Defence_Agency%2C_High_Representative_of_the_Union_for_Foreign_Affairs_and_Security_Policy_%26_Vice-President_of_the_European_Commission_%2813468295505%29.jpg/330px-thumbnail.jpg,,,No authorisation required,unpaid,,,- ,no,http://ec.europa.eu/transparency/regdoc/rep/10061/2015/EN/10061-2015-2122-EN-F1-1.Democratic PartyF,http://www.asktheeu.org/en/request/1948/response/7004/attach/3/annexes.Democratic Partyf,,
138,Antonio Tajani,Italy,EPP,Forza Italia - Forward Italy,European Commission,Commissioner for Industry and Entrepreneurship,MEP,Public Sector,Elected office,no,1,http://www.europarl.europa.eu/meps/en/2187/ANTONIO_TAJANI_home.html,,No,https://upload.wikimedia.org/wikipedia/commons/thumb/5/50/Members_of_the_Presidency_%289290654981%29.jpg/330px-Members_of_the_Presidency_%289290654981%29.jpg,,,No authorisation required,paid  ,,,- ,no,http://www.europarl.europa.eu/meps/en/2187/ANTONIO_TAJANI_home.html,,,
141,Androulla Vassiliou,Cyprus,ALDE,United Democrats,European Commission,"Commissioner for Education, Culture, Multilingualism and Youth",Representative of Cyprus on the High Council of the European University Institute,Academia,University,no,4,http://ec.europa.eu/transparency/regdoc/rep/10061/2015/EN/10061-2015-2120-EN-F1-1.PdF,,Yes,https://upload.wikimedia.org/wikipedia/commons/thumb/4/4d/Androulla_Vassiliou2.jpg/330px-Androulla_Vassiliou2.jpg,,,,unpaid,,,18/3/2015,yes,http://ec.europa.eu/transparency/regdoc/rep/10061/2015/EN/10061-2015-2120-EN-F1-1.Democratic PartyF,http://www.asktheeu.org/en/request/2136/response/7678/attach/3/Annexes.Democratic Partyf + http://www.asktheeu.org/en/request/2136/response/7678/attach/4/annexes.Democratic Partyf,,
150,Andris Piebalgs,Latvia,NI ,Independent,European Commission,Commissioner for Development,President of the Unity Party,Public Sector,Political party,no,6,,,Yes,https://upload.wikimedia.org/wikipedia/commons/thumb/2/25/Andris_Piebalgs-IMG_3681.jpg/300px-Andris_Piebalgs-IMG_3681.jpg,,,,,,,,,http://www.vienotiba.lv/par-mums/vienotibas-valde/,,,
151,Algirdas Šemeta,Lithuania,EPP,Homeland Union,European Commission,Commissioner for Taxation and customs union,Business Ombudsman for Ukraine ,Public Sector,Public Sector,no,1,http://ec.europa.eu/transparency/regdoc/rep/10061/2014/EN/10061-2014-2107-EN-F1-1.Pdf,,No,https://upload.wikimedia.org/wikipedia/commons/7/78/Algirdas_%C5%A0emeta.jpg,,,,,,,25/11/2014,yes,http://ec.europa.eu/transparency/regdoc/rep/10061/2014/EN/10061-2014-2107-EN-F1-1.Democratic Partyf,http://www.asktheeu.org/en/request/1549/response/5975/attach/8/annex%20iv.Democratic Partyf + http://www.asktheeu.org/en/request/1549/response/6127/attach/6/annex%20iii.Democratic Partyf + http://www.asktheeu.org/en/request/1549/response/6127/attach/7/annex%20iv.Democratic Partyf,,
153,Jonathan Hill,UK,ECR,Conservative,European Commission,"Commissioner for Financial Stability, Financial Services and Capital Markets Union",Member of the House of Lords,Public Sector,Elected office,no,2,,,No,https://upload.wikimedia.org/wikipedia/commons/3/3e/Jonathan_Hopkin_Hill%2C_Baron_Hill_of_Oareford.jpg,,,,,,,,,,,,
23788,Adam Bielan,Poland,ECR,Law and Justice,European parliament,MEP,Deputy Speaker of the Polish Senate ,Public Sector,Elected office,no,1,"http://www.senat.gov.pl/en/senators/lista-senatorow/senator,896,9,adam-bielan.html",,No,,,PiS,,,,Raphael,,,,,,
33990,Adrian Severin,Romania,S&D,Social Democratic Party,European parliament,MEP,Sentenced to 3 years of prison in 2016,Other,Prison,no,1,http://www.politico.eu/article/ex-romanian-mep-jailed-over-cash-for-amendments-scandal/,,No,,,,Confirm,,,Raphael ,,,,,,
96707,Ágnes Hankisságnes Hankiss,Hungary,EPP,Fidesz–Hungarian Civic Union,European parliament,MEP,Director of the Hamvas Institute of Cultural and Security studies  ,Academia,University,no,1,http://www.hamvasintezet.hu/en/,,No,,,,Not sure about this one,,Pb: No website on this instute.  Publishes books apparently --> Would suggest research or academic,TI-HU,,,,,,
105849,Agnès Le Brun,France,EPP,Union for a Popular Movement,European parliament,MEP,Vice-President of the Association of French Mayors; Mayor of Morlaix; Regional councillor of Britanny;,NGO,NGO,yes,3,https://fr.wikipedia.org/wiki/Agn%C3%A8s_Le_Brun,,Yes,,,UMP,,,,TI-FR,,,,,,
96652,Alajos Mészáros,Slovakia,EPP,Party of the Hungarian Coalition,European parliament,MEP,Professor Faculty of Chemical and Food Technology ,Academia,University,no,1,http://www.cubcce.eu/speaker/alajos-meszaros/,,No,,,,,,,Raphael,,,,,,
96667,Alan Kelly,Ireland,S&D,Labour Party,European parliament,MEP,Member of the Irish parliament,Public Sector,Elected office,no,1,https://goo.gl/vTvikd,,No,,,,,,,Raphael,,,,,,
113487,Alda Sousa,Portugal,GUE/NGL,Left Bloc,European parliament,MEP,Teacher at the University of Porto; National Board Member of the Left Bloc,Academia,University,no,2,https://pt.wikipedia.org/wiki/Alda_Sousa,,No,,,BE,,,,Raphael,,,,,,
4337,Alejandro Cercas,Spain,S&D,Socialist Workers' Party,European parliament,MEP,Retired,Other,Retired / Deceased,no,1,,,No,,,PSOE,Most likely retired,,,Raphael,,,,,,
4308,Alejo Vidal-Quadras,Spain,EPP,Popular Party,European parliament,MEP,President of the ISJ Committee; President of the Concordia Foundation; Columnist for Vox populi; Collaborator for Onda Cero Radio ,NGO,NGO,yes ,3,https://goo.gl/TY2ufj,,No,,,PP,,,,Raphael,,,,,,
28246,Alexander Alvaro,Germany,ALDE,Free Democratic Party,European parliament,MEP,"Self-employed Advisor for the Digital Agenda, Data Protection and EU Affairs",Private sector,Consultancy,yes ,1,https://www.linkedin.com/in/alexander-alvaro-131321a7,,Yes,,,,https://www.thelocal.de/20140403/vp-of-parliament-charged-with-manslaughter,,,Raphael ,,,,,,
96999,Alexander Mirsky,Latvia,S&D,Alternative,European parliament,MEP,Actor,Private Sector,Media,no,1,https://goo.gl/ZuGOlJ,,No,,,,Check with Daniel ,,,Raphael,,,,,,
96874,Alexandra Thein,Germany,ALDE,Free Democratic Party,European parliament,MEP,Lawyer and Notary,Private sector,Law firm,no,1,https://www.linkedin.com/in/alexandra-thein-5649b921,,No,,,,,,,TI-DE,,,,,,
96678,Alf Svensson,Sweden,EPP,Christian Democrats,European parliament,MEP,Board of Directors of the family first foundation ,NGO,NGO,no,1,http://www.familjenforst.nu/styrelsen/,,No,,,,Focussed on defending the family as a fundament in Swedish  culture. ,,,Raphael,,,,,,
28422,Alfredo Antoniozzi,Italy,EPP,Forza Italia ,European parliament,MEP,Member of the Board of directors of ENEL,Private Sector,Company and Group,no,1,https://goo.gl/p66nOL,,Yes,,,,Member of the Board of Directors for Enel,,,Raphael,,,,,,
97197,Alfredo Pallone,Italy,EPP,New Centre Right,European parliament,MEP,No information available,Unknown,Unknown,Unknown,1,,,No,,,,,,,Raphael,,,,,,
96988,Alfreds Rubiks,Latvia,GUE/NGL,Communist Party,European parliament,MEP,Retired,Other,Retired / Deceased,no,1,https://en.wikipedia.org/wiki/Alfr%C4%93ds_Rubiks,,No,,,,,,,Raphael,,,,,,
4423,Amalia Sartori,Italy,EPP,Forza Italia,European parliament,MEP,No information available,Unknown,Unknown,Unknown,1,https://it.wikipedia.org/wiki/Amalia_Sartori,,No,,,,Was emboilled in judicial proceedings for illegal financing. Most likely retired ,,,Raphael,,,,,,
108570,Amelia Andersdotter,Italy,Greens/EFA,Pirate Party,European parliament,MEP,Chairman of dataskydd (dataprotection); Advisory Member of the Internet Governance Forum (U.N. forum),NGO,NGO,yes ,2,https://www.facebook.com/aandersdotter/about?section=education&pnref=about,,Yes,,,,Registered in the TR but does not seem to lobby in the EU ,,,Raphael,,,,,,
24942,Ana Maria Miranda Paz,Spain,Greens/EFA,Galician Nationalist Bloc,European parliament,MEP,No information available,Unknown,Unknown,Unknown,1,,,No,,,BNG,Confirmed,,,Raphael,,,,,,
96719,Andrea Cešková,Czech Republic,ECR,Civic Democratic Party,European parliament,MEP,No information available,Unknown,Unknown,Unknown,1,,,No,,,,No info found,,,Raphael,,,,,,
