108329,Andrea Zanoni,Italy,S&D,Democratic Party,European parliament,MEP,Member of the Regional Council of Veneto; President of the Circle Ecodem (Ecologists and Democrats) in Treviso; President of the League for the Abolition of poaching,Public Sector,Elected office,no,1,http://www.consiglioveneto.it/crvportal/pageContainer.jsp;jsessionid=F1EFBE5DAD0D4EBC7888BA3ECCAF8A63?n=5&p=&c=1&e=12&t=&key=1254,,No,,,DP,,,,Raphael,,,,,,
28255,Andreas Mölzer,Austria,NI,Freedom Party,European parliament,MEP,Editor for Zur Zeit,Private Sector,Media,no,1,http://zurzeit.eu/seiten/impressum_1?SID=686c2689a0cb05c09edac96cbec0fd8f3d9d936a,,No,,,,,,,TI-AT,,,,,,
118144,Andreas Pitsillides,Cyprus,EPP,Democratic Rally,European parliament,MEP,Theologian ,Other,Religious community,no,1,https://nl.wikipedia.org/wiki/Andreas_Pitsillides,,No,,,,,,,TI-CY,,,,,,
96989,Andrés Perelló Rodríguez,Spain,S&D,Socialist Workers' Party,European parliament,MEP,Lawyer; Writer,Private Sector,Law firm,no,1,https://www.facebook.com/andres.perellorodriguez/about?section=education&pnref=about,,No,,,PSOE,,,,Raphael,,,,,,
4514,Andrew Duff,United Kingdom,ALDE,Liberal Democrats,European parliament,MEP,Senior Advisor at European Policy Centre; Advisory Board Member of Transparency International EU; Writer/Bloger,Academia,Think tank,yes ,1,http://www.epc.eu/team.php?dept_id=7,,Yes,,,LibDem,Need to verify classification ,,,Raphael,,,,,,
96749,Andrew Henry William Brons,United Kingdom,NI,British Democratic Party,European parliament,MEP,President of British Democratic Party,Public Sector,Political party,no,1,http://www.dailystormer.com/british-renaissance-jez-turner-and-andrew-brons/,,No,,,BDP,Really not sure that is his job. Can you look again?,,No further info found. Gives public speeches,Raphael ,,,,,,
97016,Angelika Werthmann,Austria,NI,Hans-Peter Martin's List,European parliament,MEP,No information available,Unknown,Unknown,Unknown,1,http://www.wileurope.org/Sys/PublicProfile/33267225/4004500,,No,,,,Check this. Job?,,She is just mentionned in the dorectory of the organisation European network for woman in leadership. Not an active Member,Raphael,,,,,,
28227,Anja Weisgerber,Germany,EPP,Christian Social Union,European parliament,MEP,Member of the Bundestag; Lawyer for GSK Stockman ,Public Sector,Elected office,no,2,http://www.gsk.de/en/person/anja.weisgerber/,,No,,,,,,,TI-DE,,,,,,
28125,Anna Ibrisagic,Sweden,EPP,Moderate Party,European parliament,MEP,No information available; Position at Serio Government Affairs pending,Unknown,Unknown,Unknown,1,https://www.facebook.com/anna.ibrisagic,,No,,,M,"Shows on FB that she went to the TATRA 2016 summit ""shaping the future of Europe"" This person is clearly in some form of lobbying activity",,http://www.expressen.se/dinapengar/ex-ministrarna-bildar-nu-nytt-superbolag/,Raphael,,,,,,
96664,Anna Rosbach,Denmark,EFDD,People's Party,European parliament,MEP,Retired,Other,Retired / Deceased,no,1,https://da.wikipedia.org/wiki/Anna_Rosbach_Andersen,,No,,,,,,,Raphael,,,,,,
96914,Anne Delvaux,Belgium,EPP,Humanist Democratic Centre,European parliament,MEP,Personal coach ,Private Sector,Self-employed,no,1,http://www.adcoaching.be/mon-profil/,,No,,,cdH,,,,Raphael,,,,,,
4440,Anne E. Jensen,Denmark,ALDE,"Left, Liberal Party",European parliament,MEP,Retired,Other,Retired / Deceased,no,1,https://da.wikipedia.org/wiki/Anne_E._Jensen,,No,,,,,,,Raphael,,,,,,
123816,Annette Koewius,Germany,EPP,Christian Democrats Union,European parliament,MEP,Chair of the Women's Union Kreisverband Mettmann,NGO,NGO,no,1,http://www.frauen-union-kreismettmann.de/,,No,,,CDU,,,,TI-DE ,,,,,,
39317,Anni Podimata,Greece,S&D,Socialist Movement,European parliament,MEP,Consultant on Communications and EU Affairs/Energy Intensive Industries; Journalist,Private Sector,Consultancy,yes ,2,https://www.linkedin.com/in/anni-podimata-3b151196,,No,,,,No website and no name of the Consultancy in question ,,Secretive ,Raphael,,,,,,
97050,Antigoni Papadopoulou,Cyprus,S&D,Democratic Party,European parliament,MEP,President of the women’s Organisation of DIKO (GODIK),NGO,NGO,no,1,https://en.wikipedia.org/wiki/Antigoni_Papadopoulou,,No,,,,,,,TI-CY,,,,,,
28295,Antolín Sánchez Presedo,Spain,S&D,Spanish Socialist Workers' Party,European parliament,MEP,No information available,Unknown,Unknown,Unknown,1,https://es.wikipedia.org/wiki/Antol%C3%ADn_S%C3%A1nchez_Presedo,,No,,,PSOE,,,,Raphael,,,,,,
97193,Antonello Antinoro,Italy,EPP,Union of Christian and Centre Democrats,European parliament,MEP,No information available; Awaiting trial,Unknown,Unknown,Unknown,1,https://it.wikipedia.org/wiki/Antonello_Antinoro,,No,,,UDC,Currently on trial. No decision has been taken,,,Raphael,,,,,,
96733,Antonio Cancian,Italy,EPP,Christian Democrats ,European parliament,MEP,President and CEO of Rete Autostrade Mediterranee,Public Sector,Company and Group,Yes,1,https://www.linkedin.com/in/antoniocancian,,Yes,,,,,,,Raphael,,,,,,
96975,António Fernando Correia De Campos,Portugal,S&D,Socialist Party,European parliament,MEP,Journalist,Private Sector,Media,no,1,,,No,,,,,,,Raphael,,,,,,
28338,Antonio Masip Hidalgo,Spain,S&D,Socialist Workers' Party,European parliament,MEP,No information available,Unknown,Unknown,Unknown,1,,,No,,,,,,,Raphael,,,,,,
34234,Antonyia Parvanova,Bulgaria,ALDE,National Movement for Stability and Progress,European parliament,MEP,Co-President to the Fit for Work Europe Coalition; Member of the NDSV/NMSP,NGO,NGO,yes ,2,http://www.fitforworkeurope.eu/About/about.htm,,No,,,,The fit for work is aimed at improving working conditions. But it does seem to focus on intense lobbying efforts in Brussels and in the countries holding the Presidency ,,,Raphael,,,,,,
111126,Arkadiusz Tomasz Bratkowski,Poland,EPP,Polish People's Party,European parliament,MEP,No information available,Unknown,Unknown,Unknown,1,,,No,,,PSL,,,,Raphael,,,,,,
2173,Arlene Mccarthy,United Kingdom,S&D,Labour Party,European parliament,MEP,Director of AMC Strategy; Deputy chair for European strategy at Sovereign Strategy,Private Sector,Consultancy,yes ,2,https://corporateeurope.org/revolvingdoorwatch/cases/arlene-mccarthy http://ec.europa.eu/transparencyregister/public/consultation/displaylobbyist.do?id=114802815648-64,,Yes,,,,,,,Raphael,,,,,,
96778,Artur Zasada,Poland,EPP,Civic Platform,European parliament,MEP,Member of the Polish parliament,Public Sector,Elected office,no,1,http://www.sejm.gov.pl/Sejm8.nsf/posel.xsp?id=444,,No,,,,,,,Raphael,,,,,,
28130,Åsa Westlund,Sweden,S&D,Social Democratic Party,European parliament,MEP,Member of Swedish parliament,Public Sector,Elected office,no,1,https://www.riksdagen.se/sv/ledamoter-partier/ledamot/asa-westlund_73281fee-b276-4150-8cf0-fd3368b3c5c6,,No,,,,,,,Raphael,,,,,,
1186,Astrid Lulling,Luxembourg,EPP,Christian Social People's Party,European parliament,MEP,Retired,Other,Retired / Deceased,no,1,https://en.wikipedia.org/wiki/Astrid_Lulling,,No,,,,,,,Raphael,,,,,,
28583,Athanasios Pafilis,Greece,GUE/NGL,Communist Party,European parliament,MEP,Member of the Greek parliament ,Public Sector,Elected office,no,1,http://www.hellenicparliament.gr/en/Vouleftes/Stoicheia-Epikoinonias-Voulefton?MPId=f93525ad-fdc4-444c-a286-79b8c6724558,,No,,,,,,,Raphael,,,,,,
97010,Athanasios Plevris,Greece,EFDD,Popular Orthodox Rally,European parliament,MEP,Municipal Councillor of the city of Athens ,Public Sector,Elected office,no,1,http://www.thanos-plevris.gr/?q=node/5,,No,,,,,,,Raphael,,,,,,
28511,Bairbre De Brún,United Kingdom,GUE/NGL,Sinn Féin,European parliament,MEP,No information available,Unknown,Unknown,Unknown,1,,,No,,,,No information available ,,,Raphael,,,,,,
124586,Balázs Hidvéghi,Hungary,EPP,Fidesz-MPP,European parliament,MEP,Spokesman for the Hungarian National Bank; Deputy Director for Strategy for Fidesz-Hungarian Civic Union,Public Sector,Public Sector,no,2,https://en.wikipedia.org/wiki/Bal%C3%A1zs_Hidv%C3%A9ghi,,No,,,,,,,Raphael,,,,,,
1907,Barbara Weiler,Germany,S&D,Social Democratic Party,European parliament,MEP,No information available,Unknown,Unknown,Unknown,1,,,No,,,,,,,TI-DE,,,,,,
4529,Baroness Sarah Ludford,United Kingdom,ALDE,Liberal Democrats,European parliament,MEP,Spokesman on Europe for the House of Lords; Member of the House of Lords,Public Sector,Elected office,no,2,https://www.parliament.uk/biogRaphaelies/lords/baroness-ludford/1867,,No,,,LibDem,,,,Raphael,,,,,,
96904,Barry Madlener,Netherlands,NI,Party for Freedom,European parliament,MEP,Member of the House of Representatives of the Netherlands,Public Sector,Elected office,no,1,https://www.tweedekamer.nl/kamerleden/alle_kamerleden/madlener-b-pvv,,No,,,PVV,,,,Raphael,,,,,,
28145,Béla Glattfelder,Hungary,EPP,Fidesz–Hungarian Civic Union,European parliament,MEP,CEO of the national hungarian railway company ,Public Sector,Public Sector,no,1,,,No,,,,,,,TI-HU,,,,,,
28177,Bernadette Vergnaud,France,S&D,Socialist Party,European parliament,MEP,Vice-President of Confrontations Europe,Academia,Think tank,yes ,1,https://www.linkedin.com/in/association-confrontations-europe-201b7223,,Yes,,,,According to linkedin but not mentionned as vice-President on official website,,,TI-FR,,,,,,
2229,Bernd Posselt,Germany,EPP,Christian Social Union (Bavaria),European parliament,MEP,Freelance journalist; Foreign policy adviser to the CSU European Group; Author,Private Sector,Media,no,1,http://www.telegRaphael.co.uk/news/worldnews/europe/germany/11795374/German-MEP-who-lost-his-seat-still-turning-up-to-parliament.html,,No,,,,Note: stilll very active politically inside the EP and plans to stand for EP election in 2019,,,Raphael,,,,,,
1906,Bernhard Rapkay,Germany,S&D,Social Democratic Party,European parliament,MEP,No information available,Unknown,Unknown,Unknown,1,,,No,,,,,,,TI-DE,,,,,,
1394,Bill Newton Dunn,United Kingdom,ALDE,Liberal Democrats,European parliament,MEP,Retired,Other,Retired / Deceased,no,1,https://en.wikipedia.org/wiki/Bill_Newton_Dunn,,No,,,LibDem,Lost elections in 2014. Retired from public life,,,Raphael,,,,,,
96827,Birgit Schnieber-Jastram,Germany,EPP,Christian Democratic Union,European parliament,MEP,Retired,Other,Retired / Deceased,no,1,,,No,,,CDU,,,,TI-DE,,,,,,
96792,Bogdan Kazimierz Marcinkiewicz,Poland,EPP,Civic Platform,European parliament,MEP,No information available,Unknown,Unknown,Unknown,1,,,No,,,,confirm,,,Raphael,,,,,,
28299,Boguslaw Sonik,Poland,EPP,Civic Platform,European parliament,MEP,Member of the Polish parliament,Public Sector,Elected office,no,1,http://www.sejm.gov.pl/Sejm8.nsf/posel.xsp?id=357&type=W&wojewodztwo=ma%C5%82opolskie,,No,,,,,,,Raphael ,,,,,,
1309,Brian Simpson,United Kingdom,S&D,Labour Party,European parliament,MEP,Senior consultant at Hume Brophy,Private Sector,Consultancy,yes ,1,https://corporateeurope.org/revolvingdoorwatch/cases/brian-simpson,,Yes,,,,,,,Raphael,,,,,,
96875,Britta Reimers,Germany,ALDE,Free Democratic Party,European parliament,MEP,Dairy and crop farmer,Private sector,Self-employed,no,1,https://www.facebook.com/pg/brittareimersmdep/about/?ref=page_internal,,No,,,,,,,TI-DE,,,,,,
28153,Britta Thomsen,Denmark,S&D,Social Democrats,European parliament,MEP,Owner of Britta Thomsen Consulting; Adjunct professor at Copenhagen Business School (CBS),Private Sector,Consultancy,no,2,https://www.linkedin.com/in/brittathomsendk,,No,,,,,,,Raphael,,,,,,
96683,Carl Haglund,Finland,ALDE,Swedish People's Party,European parliament,MEP,CEO of Kaidi New Energy Finland; Vice-President Europe Strategy for worldyide Kaidi group; Board Member of Milton; ,Private Sector,Company and Group,yes ,2,https://corporateeurope.org/revolvingdoorwatch/cases/carl-haglund,,Yes,,,,,,https://goo.gl/4XwlLA,Raphael ,,,,,,
28139,Carl Schlyter,Sweden,Greens/EFA,Green Party,European parliament,MEP,Member of the Swedish parliament,Public Sector,Elected office,no,1,https://www.riksdagen.se/sv/ledamoter-partier/ledamot/carl-schlyter_46eb7b79-60e3-4bcc-9077-dbd9091aa54d,,No,,,,,,,Raphael,,,,,,
988,Carlo Casini,Italy,EPP,Christian Democracy,European parliament,MEP,Retired,Other,Retired / Deceased,no,1,https://it.wikipedia.org/wiki/Carlo_Casini,,No,,,CD,,,,Raphael ,,,,,,
96810,Carlo Fidanza,Italy,EPP,The people of freedom,European parliament,MEP,"Commissioner at the ""In Liguria"" tourism agency ",Public Sector,Public Sector,no,1,https://goo.gl/orQY6k,,No,,,,,,,Raphael,,,,,,
1993,Carmen Fraga Estévez,Spain,EPP,People's Party,European parliament,MEP,No information available,Unknown,Unknown,Unknown,1,https://es.wikipedia.org/wiki/Carmen_Fraga_Est%C3%A9vez,,No,,,PP,,,,Raphael,,,,,,
96990,Carmen Romero López,Spain,S&D,Socialist Workers' Party,European parliament,MEP,Retired,Other,Retired / Deceased,no,1,,,No,,,PSOE,,,,Raphael,,,,,,
4524,Caroline Lucas,United Kingdom,Greens/EFA,Green Party,European parliament,MEP,MP of the Britsh parliament,Public Sector,Elected office,no,1,https://www.parliament.uk/biogRaphaelies/commons/caroline-lucas/3930,,No,,,,,,,Raphael,,,,,,
96745,Catherine Grèze,France,Greens/EFA,Europe Ecology,European parliament,MEP,Member of the Executive Committee of the European Federation of Green Parties,Public Sector,Political party,no,1,,,No,,,,Unclear if these are jobs,,,TI-FR,,,,,,
97294,Catherine Soullie,France,EPP,Union for a Popular Movement,European parliament,MEP,No information available,Unknown,Unknown,Unknown,1,,,No,,,UMP,,,,TI-FR,,,,,,
1129,Catherine Trautmann,France,S&D,Socialist Party,European parliament,MEP,European Coordinator for the North Sea-Baltic TEN-T Corridor ,Public Sector,Public Sector,no,1,https://ec.europa.eu/transport/themes/infrastructure/ten-t-guidelines/european-coordinators_en,,No,,,PS,,,,TI-FR,,,,,,
99419,Charalampos Angourakis,Greece,GUE/NGL,Communist Party,European parliament,MEP,Deceased in 2014,Other,Retired / Deceased,no,1,https://en.wikipedia.org/wiki/Babis_ANGOsurakis,,No,,,KKE,,,,Raphael,,,,,,
4554,Chris Davies,United Kingdom,ALDE,Liberal Democrats,European parliament,MEP,Owner of Chris Davies Ltd,Private Sector,Consultancy,yes ,1,https://corporateeurope.org/revolvingdoorwatch/cases/chris-davies ,,Yes,,,LibDem,,,,Raphael,,,,,,
1929,Christa Klass,Germany,EPP,Christian Democratic Union,European parliament,MEP,Member of the Bernkastel-Wittlich district council; Member of the municipal council of Osann-Monzel,Public Sector,Elected office,no,2,https://de.wikipedia.org/wiki/Christa_Kla%C3%9F,,No,,,,,,,TI-DE,,,,,,
96676,Christian Engström,Sweden,Greens/EFA,Pirate Party,European parliament,MEP,No information available,Unknown,Unknown,Unknown,1,,,No,,,,Confirm,,,Raphael,,,,,,
4347,Christine De Veyrac,France,EPP,Union for a Popular Movement,European parliament,MEP,Editorialist at Sud Radio,Private Sector,Media,no,1,https://www.linkedin.com/in/christine-de-veyrac-43a34042,,No,,,UMP,,,,Raphael,,,,,,
97002,Christophe Béchu,France,EPP,Union for a Popular Movement,European parliament,MEP,Mayor of Angers; Senator,Public Sector,Elected office,no,2,https://fr.wikipedia.org/wiki/Christophe_B%C3%A9chu,,No,,,UMP,,,,TI-FR,,,,,,
97007,Chrysoula Paliadeli,Greece,S&D,Socialist Movement,European parliament,MEP,Archaeology Professor at the Aristotle University of Thessaloniki,Academia,University,no,1,http://www.global-politics.org/about-us/advisory-board/index.html,,Yes,,,,,,,Raphael,,,,,,
118860,Claudette Abela Baldacchino,Malta,S&D,Labour Party,European parliament,MEP,President of Nisa Laburisti (Wman's rights pressure group),Public Sector,Political party,no,1,http://www.nisalaburisti.org/executive.html,,No,,,,,,,Raphael,,,,,,
97280,Claudio Morganti,Italy,EFDD,Lega Nord,European parliament,MEP,Area manager at Uniposte (commercial post and banking company),Private Sector,Company and Group,no,1,https://www.linkedin.com/in/claudiomorganti,,No,,,,,,,Raphael ,,,,,,
122404,Claus Larsen-Jensen,Denmark,S&D,Social Democrats,European parliament,MEP,Director of the Forum for International Cooperation,NGO,NGO,no,1,https://en.fic.dk/daily-management/,,No,,,,Looks more like a NGO/Consultancy ,,Check again with Daniel ,Raphael,,,,,,
4462,Clemente Mastella,Italy,EPP,Forza Italia ,European parliament,MEP,Mayor of Benevento,Public Sector,Elected office,no,1,https://goo.gl/jRzh2V,,No,,,,,,,Raphael ,,,,,,
28167,Corien Wortmann-Kool,Netherlands,EPP,Christian Democratic Appeal,European parliament,MEP,Supervisory board member of Aegon NV; Supervisory board member of ABP; Supervisory board member of Kadaster; Vice-President of the EPP party; Member of the Dutch Central Bureau of Statistics; Board member for Save the Children NL,Private Sector,Company and Group,yes ,4,https://corporateeurope.org/revolvingdoorwatch/cases/corien-wortmann-kool,,Yes,,,CDA,,,,Raphael,,,,,,
97076,Corinne Lepage,France,ALDE,Democratic Movement,European parliament,MEP,Lawyer,Private Sector,Law firm,no,1,https://fr.wikipedia.org/wiki/Corinne_Lepage,,No,,,MoDem,,,,TI-FR,,,,,,
96845,Corneliu Vadim Tudor,Romania,NI,Greater Romania Party,European parliament,MEP,Deceased in 2015,Other,Retired / Deceased,no,1,https://en.wikipedia.org/wiki/Corneliu_Vadim_Tudor,,No,,,PRM,,,,Raphael,,,,,,
97199,Crescenzio Rivellini,Italy,EPP,Forza Italia,European parliament,MEP,No information available,Unknown,Unknown,Unknown,1,https://it.wikipedia.org/wiki/Enzo_Rivellini,,No,,,FI,,,,Raphael,,,,,,
1073,Cristiana Muscardini,Italy,EPP,The people of freedom ,European parliament,MEP,Self-employed consultant on public policies,Private Sector,Consultancy,no,1,https://www.loccidentale.it/articoli/143199/referendum-donne-per-il-no-giovedi-a-roma,,No,,,,"Check this - this doesn't seem to be active. Ms. Muscardini is active President of the COmmitte for the no but there is no website, only news articles ",,,Raphael,,,,,,
4326,Cristina Gutiérrez-Cortines,Spain,EPP,People's Party,European parliament,MEP,Vice-President of the Ars Civilis Foundation; Professor of History of Arts at the Murcia University,NGO,NGO,no,2,http://www.arscivilis.org/en/quienes-somos/,,No,,,PP,,,,Raphael,,,,,,
23819,Csaba Ory,Hungary,EPP,Fidesz–Hungarian Civic Union,European parliament,MEP,Ambassador to Vietnam,Public Sector,Public Sector,no,1,http://hanoi.kormany.hu/nagykoveti-koszonto,,No,,,,According to TI-HU: Ambassador in Vietnam but official website of the embassy states anOthers person,,,Raphael,,,,,,
23808,Csaba Sándor Tabajdi,Hungary,S&D,Socialist Party,European parliament,MEP,No information available,Unknown,Unknown,Unknown,1,,,No,,,,Unkown ,,,TI-HU,,,,,,
96855,Csanád Szegedi,Hungary,NI,Jobbik–The Movement for a Better Hungary,European parliament,MEP,No information available; Resigned from political posts and moved to Israel for religious reasons ,Unknown,Unknown,Unknown,1,http://www.tabletmag.com/scroll/200877/from-anti-semite-to-jew,,No,,,,Unkown ,,No he is 34 years and has stated that he wants to get involved organisation fighting anti-semitism and perhaps entering Israeli politics,TI-HU,,,,,,
1183,Dagmar Roth-Behrendt,Germany,S&D,Social Democratic Party,European parliament,MEP,Special advisor to Commissioner Andriukaitis (DG SANTE) ,Public Sector,Public Sector,no,1,http://ec.europa.eu/civil_service/about/who/sa_en.htm,,No,,,SPD,,,,Raphael,,,,,,
117119,Dan Dumitru Zamfirescu,Romania,NI,Greater Romania Party,European parliament,MEP,Retired,Other,Retired / Deceased,no,1,https://ro.wikipedia.org/wiki/Dan_Zamfirescu_(politician),,No,,,PRM,Confirm,,,Raphael,,,,,,
28156,Dan Jørgensen,Denmark,S&D,Social Democrats,European parliament,MEP,Lecturer at the Danish Institute for Study Abroad,Academia,University,no,1,https://da.wikipedia.org/wiki/Dan_J%C3%B8rgensen,,No,,,,,,,Raphael,,,,,,
1934,Daniel Cohn-Bendit,France,Greens/EFA,Europe Ecology,European parliament,MEP,Writer/Moderator,Private Sector,Media,no,1,,,No,,,,,,,TI-FR,,,,,,
96946,Daniël Van Der Stoep,Netherlands,NI,Party for Freedom ,European parliament,MEP,No information available,Unknown,Unknown,Unknown,1,https://nl.wikipedia.org/wiki/Dani%C3%ABl_van_der_Stoep,,No,,,PVV,Was sentenced to prison in December 2015. Should no longer be in prison ,,,Raphael,,,,,,
96865,Debora Serracchiani,Italy,S&D,Democratic Party,European parliament,MEP,President of Friuli-Venezia Giulia region,Public Sector,Elected office,no,1,http://www.presidente.regione.fvg.it/debora/serracchiani/,,No,,,PD,,,,Raphael,,,,,,
28493,Derek Roland Clark,United Kingdom,EFDD,UK Independence Party,European parliament,MEP,Retired,Other,Retired / Deceased,no,1,https://en.wikipedia.org/wiki/Derek_Clark,,No,,,UKIP,Born in 1933. Most likely retired ,,,Raphael ,,,,,,
97133,Derk Jan Eppink,Belgium,ECR,"List Dedecker / Libertarian, Direct, Democratic",European parliament,MEP,Senior Fellow at the London Center for Policy Research,Academia,Think tank,no,1,http://www.djeppink.eu/,,No,,,,London Center for Policy Research is active in lobbying efforts  in the US Congress ,,,Raphael ,,,,,,
4544,Diana Wallis,United Kingdom,ALDE,Liberal Democrats,European parliament,MEP,President of the European Law Institute; Member of the board of directors of the International Mediation Institute,Private Sector,Law firm,yes ,2,http://www.europeanlawinstitute.eu/about-eli/,,Yes,,,LibDem,,,,Raphael,,,,,,
34254,Dimitar Stoyanov,Bulgaria,NI,Attack,European parliament,MEP,Chairman of the National democratic party,Public Sector,Political party,no,1,,,No,,,,No link,,,TI-BG,,,,,,
107977,Dimitrios Droutsas,Greece,S&D,Panhellenic Socialist movement,European parliament,MEP,No information available,Unknown,Unknown,Unknown,1,,,No,,,PASOK,Check TI-GR ? Strange that this guy is up to nothing ,,,Raphael,,,,,,
96977,Diogo Feio,Portugal,EPP,Democratic and Social Centre–People's Party,European parliament,MEP,Partner at SERVULO law firm; Lecturer at the Faculty of Law of the University of Porto; Lecturer at the Oporto Business School ,Private Sector,Law firm,no,3,https://www.servulo.com/en/team/partners/Diogo-Feio/3593/,,No,,,,,,,Raphael,,,,,,
4243,Dirk Sterckx,Belgium,ALDE,Open Flemish Liberals and Democrats,European parliament,MEP,Member of the supervisory board of the SNCB; Director of the Audit Committee of the SNCB,Public Sector,Public Sector,no,2,http://www.etaamb.be/fr/arrete-royal-du-14-octobre-2013_n2013014609.html,,No,,,,Nomited by royal decree,,,Raphael ,,,,,,
111017,Dolores García-Hierro Caraballo,Spain,S&D,Socialist Workers' Party,European parliament,MEP,No information available,Unknown,Unknown,Unknown,1,https://www.facebook.com/garciahierrocaraballo/about?section=education&pnref=about,,No,,,PSOE,Confirmed,,,Raphael,,,,,,
1759,Dominique Baudis,France,EPP,Union for a Popular Movement,European parliament,MEP,Deceased in 2014,Other,Retired / Deceased,no,1,https://fr.wikipedia.org/wiki/Dominique_Baudis,,No,,,UMP,,,,TI-FR,,,,,,
5737,Dominique Vlasto,France,EPP,Union for a Popular Movement,European parliament,MEP,Councillor to the Mayor of Marseilles,Public Sector,Elected office,no,1,http://mairie.marseille.fr/gouvernement-municipal/elus,,No,,,UMP,,,,Raphael,,,,,,
1191,Doris Pack,Germany,EPP,Christian Democratic Union,European parliament,MEP,Chairwoman of the Advisory Board of A Soul for Europe,NGO,NGO,no,1,http://www.asoulforeurope.eu/about-us/mission-statement,,No,,,,Note: the organisation does state it is a link between civil society and the EP on the issue of culture,,,Raphael,,,,,,
23866,Edit Bauer,Slovakia,EPP,Party of the Hungarian Coalition,European parliament,MEP,Member of the Centre for European Affairs,Academia,Think tank,yes ,1,http://www.europeanaffairs.sk/sk/edit-bauer,,No,,,,Double check because she might no longer be active in the oorganisation ,,,Check,,,,,,
28155,Edit Herczog,Hungary,S&D,Socialist Party,European parliament,MEP,"Founder, owner and managing director of Vision & Values SPRL",Private Sector,Consultancy,yes ,1,http://europe.rd-alliance.org/weaving-internet-of-data-high-level-policy-meeting-speaker-profiles,,No,,,,Vision and Values is a brussels-based Consultancy with large multinational companies as their clients as well institutional clients. Clear CoI here..,,,TI-HU ,,,,,,
28310,Edite Estrela,Portugal,S&D,Socialist Party,European parliament,MEP,Member of the Portuguese parliament ,Public Sector,Elected office,no,1,https://www.parlamento.pt/DeputadoGP/Paginas/Biografia.aspx?BID=162,,No,,,,,,,Raphael,,,,,,
96704,Edvard Kožušník,Czech Republic,ECR,Civic Democratic Party,European parliament,MEP,Managing Partner at Justus Lipsius & Partners; Director at eStat,Private sector,Law firm,yes ,2,https://www.linkedin.com/in/edvardkozusnik,,No,,,,,,,Raphael ,,,,,,
1405,Edward Mcmillan-Scott,United Kingdom,ALDE,Liberal Democrats,European parliament,MEP,Retired,Other,Retired / Deceased,no,1,https://en.wikipedia.org/wiki/Edward_McMillan-Scott,,No,,,LibDem,,,,Raphael,,,,,,
96671,Edward Scicluna,Malta,S&D,Labour Party ,European parliament,MEP,Minister for Finances,Public Sector,Elected office,no,1,https://mfin.gov.mt/en/the-minister/Pages/default.aspx,,No,,,PvDA,,,,Raphael,,,,,,
4260,Eija-Riitta Korhola,Finland,EPP,National Coalition Party,European parliament,MEP,Member of the Steering Committee of ICEF Innovation for Cool Earth Forum; Delegate of the Consultative Commission on Industrial Change (EESC);  Member of the advisory board at Momentum Capital; Board member of CEG ,Private Sector,Business association,yes ,1,https://www.linkedin.com/in/eija-riitta-korhola-phd-60795b74,,Yes,,,,"Not direct lobbying but she's involved in so many ventures that have a key interest in EU regulation, it is hard to believe this is not a revolving door case. ",,,Raphael,,,,,,
96814,Elena Basescu,Romania,EPP,Democratic Liberal Party,European parliament,MEP,"Employee of the Romanian Chamber of Commerce and Industry, department of International Relations ",Private Sector,Business association,yes ,1,https://www.antena3.ro/en/romania/elena-basescu-is-done-babysitting-and-she-took-a-job-with-the-chamber-of-commerce-there-is-the-339333.html,,No,,,,At least this is clearly a lobbying job. No apparent conflict of interest.,,,Check,,,,,,
